{
  "$schema": "https://json-schema.org/draft/2020-12/schema",
  "$id": "https://tinlance.com/schemas/transformation/v1/transformation.schema.json",
  "title": "Tinlance Transformation v1",
  "type": "object",
  "additionalProperties": false,
  "required": [
    "schema_version",
    "transformation_id",
    "version",
    "tenant_ref",
    "intent",
    "actor",
    "context",
    "requested_capabilities",
    "constraints",
    "governance",
    "execution",
    "outputs",
    "evidence",
    "outcome",
    "provenance"
  ],
  "properties": {
    "schema_version": {
      "const": "transformation/v1"
    },
    "transformation_id": {
      "type": "string",
      "format": "uuid"
    },
    "version": {
      "type": "integer",
      "minimum": 1
    },
    "tenant_ref": {
      "type": "string",
      "minLength": 1
    },
    "intent": {
      "type": "object",
      "additionalProperties": false,
      "required": [
        "objective",
        "success_criteria"
      ],
      "properties": {
        "objective": {
          "type": "string",
          "minLength": 1,
          "maxLength": 4096
        },
        "business_metric": {
          "type": "string",
          "maxLength": 512
        },
        "success_criteria": {
          "type": "array",
          "minItems": 1,
          "maxItems": 50,
          "items": {
            "type": "string",
            "minLength": 1,
            "maxLength": 1024
          }
        }
      }
    },
    "actor": {
      "type": "object",
      "additionalProperties": false,
      "required": [
        "principal_ref",
        "agent_ref",
        "agent_version"
      ],
      "properties": {
        "principal_ref": {
          "type": "string",
          "minLength": 1
        },
        "agent_ref": {
          "type": "string",
          "minLength": 1
        },
        "agent_version": {
          "type": "string",
          "minLength": 1
        },
        "delegated_by": {
          "type": "string",
          "minLength": 1
        }
      }
    },
    "context": {
      "type": "object",
      "additionalProperties": false,
      "required": [
        "workspace_ref",
        "task_ref"
      ],
      "properties": {
        "workspace_ref": {
          "type": "string",
          "minLength": 1
        },
        "task_ref": {
          "type": "string",
          "minLength": 1
        },
        "source_refs": {
          "type": "array",
          "maxItems": 100,
          "items": {
            "type": "string",
            "minLength": 1
          }
        }
      }
    },
    "requested_capabilities": {
      "type": "array",
      "minItems": 1,
      "maxItems": 100,
      "items": {
        "type": "object",
        "additionalProperties": false,
        "required": [
          "capability_ref",
          "reason"
        ],
        "properties": {
          "capability_ref": {
            "type": "string",
            "minLength": 1
          },
          "reason": {
            "type": "string",
            "minLength": 1,
            "maxLength": 1024
          }
        }
      }
    },
    "constraints": {
      "type": "object",
      "additionalProperties": false,
      "properties": {
        "deadline": {
          "type": "string",
          "format": "date-time"
        },
        "budget_ref": {
          "type": "string",
          "minLength": 1
        },
        "data_classification": {
          "enum": [
            "public",
            "internal",
            "confidential",
            "restricted"
          ]
        },
        "resource_refs": {
          "type": "array",
          "maxItems": 100,
          "items": {
            "type": "string",
            "minLength": 1
          }
        }
      }
    },
    "governance": {
      "type": "object",
      "additionalProperties": false,
      "required": [
        "policy_refs",
        "risk_class"
      ],
      "properties": {
        "policy_refs": {
          "type": "array",
          "minItems": 1,
          "maxItems": 50,
          "items": {
            "type": "string",
            "minLength": 1
          }
        },
        "risk_class": {
          "type": "string",
          "minLength": 1
        },
        "approval_refs": {
          "type": "array",
          "maxItems": 50,
          "items": {
            "type": "string",
            "minLength": 1
          }
        }
      }
    },
    "execution": {
      "type": "object",
      "additionalProperties": false,
      "required": [
        "state",
        "idempotency_key"
      ],
      "properties": {
        "run_ref": {
          "type": "string",
          "minLength": 1
        },
        "state": {
          "enum": [
            "planned",
            "running",
            "succeeded",
            "failed",
            "cancelled",
            "partial"
          ]
        },
        "idempotency_key": {
          "type": "string",
          "minLength": 16,
          "maxLength": 256
        },
        "started_at": {
          "type": "string",
          "format": "date-time"
        },
        "completed_at": {
          "type": "string",
          "format": "date-time"
        }
      }
    },
    "outputs": {
      "type": "array",
      "maxItems": 100,
      "items": {
        "type": "object",
        "additionalProperties": false,
        "required": [
          "ref",
          "kind"
        ],
        "properties": {
          "ref": {
            "type": "string",
            "minLength": 1
          },
          "kind": {
            "type": "string",
            "minLength": 1
          },
          "digest": {
            "type": "string",
            "pattern": "^[0-9a-f]{64}$"
          }
        }
      }
    },
    "evidence": {
      "type": "array",
      "maxItems": 200,
      "items": {
        "type": "object",
        "additionalProperties": false,
        "required": [
          "ref",
          "kind"
        ],
        "properties": {
          "ref": {
            "type": "string",
            "minLength": 1
          },
          "kind": {
            "type": "string",
            "minLength": 1
          },
          "digest": {
            "type": "string",
            "pattern": "^[0-9a-f]{64}$"
          }
        }
      }
    },
    "outcome": {
      "type": "object",
      "additionalProperties": false,
      "required": [
        "status",
        "achieved"
      ],
      "properties": {
        "status": {
          "enum": [
            "unknown",
            "achieved",
            "partially_achieved",
            "not_achieved",
            "inconclusive"
          ]
        },
        "achieved": {
          "type": "boolean"
        },
        "metrics": {
          "type": "array",
          "maxItems": 100,
          "items": {
            "type": "object",
            "additionalProperties": false,
            "required": [
              "name",
              "value"
            ],
            "properties": {
              "name": {
                "type": "string",
                "minLength": 1
              },
              "value": {
                "type": [
                  "number",
                  "string",
                  "boolean"
                ]
              },
              "unit": {
                "type": "string"
              }
            }
          }
        },
        "business_effect_refs": {
          "type": "array",
          "maxItems": 100,
          "items": {
            "type": "string",
            "minLength": 1
          }
        },
        "failure_code": {
          "type": "string",
          "minLength": 1
        }
      },
      "oneOf": [
        {
          "properties": {
            "status": {
              "const": "achieved"
            },
            "achieved": {
              "const": true
            }
          },
          "required": [
            "status",
            "achieved"
          ]
        },
        {
          "properties": {
            "status": {
              "enum": [
                "unknown",
                "partially_achieved",
                "not_achieved",
                "inconclusive"
              ]
            },
            "achieved": {
              "const": false
            }
          },
          "required": [
            "status",
            "achieved"
          ]
        }
      ]
    },
    "provenance": {
      "type": "object",
      "additionalProperties": false,
      "required": [
        "declared_by",
        "recorded_at"
      ],
      "properties": {
        "declared_by": {
          "type": "string",
          "minLength": 1
        },
        "recorded_at": {
          "type": "string",
          "format": "date-time"
        },
        "source_refs": {
          "type": "array",
          "maxItems": 100,
          "items": {
            "type": "string",
            "minLength": 1
          }
        },
        "content_digest": {
          "type": "string",
          "pattern": "^[0-9a-f]{64}$"
        }
      }
    }
  }
}
